{"contract":"4","ok":true,"cmd":"dbg.regs","result":{"gpr":{"x0":"0x00000000","x1":"0x774ee7b5","x10":"0xe73affbf","x11":"0x0000040e","x12":"0x9ff25faa","x13":"0xbef0de77","x14":"0xf370fff0","x15":"0xf634d79c","x16":"0xe97cf97c","x17":"0xdda7fe0e","x18":"0xd5d7f98e","x19":"0xbd55ebce","x2":"0x20180000","x20":"0x7f97b98d","x21":"0x95d7b98d","x22":"0xd5dd5bb7","x23":"0xd5efb99d","x24":"0xd67f598d","x25":"0xd5d7b88d","x26":"0x9ff2f3cf","x27":"0xf9ff1e9d","x28":"0x02000000","x29":"0x80000010","x3":"0x201108c0","x30":"0x80000000","x31":"0x00000002","x4":"0xf0c7b98d","x5":"0x03006983","x6":"0x01000000","x7":"0x02000000","x8":"0x5fffca33","x9":"0x40021000"},"pc":"0x00000000"}}
