{"contract":"4","ok":true,"cmd":"target.option.get","result":{"data0":"0xff","data1":"0xff","db_family":"CH32V407","family":"unknown(0xa6)","raw":"ff00bf40ff00ff00ff00ff00ff00ff00","rdpr":"0xff","read_protected":true,"user":"0xbf","user_bits":{"IWDGSW":true,"STANDYRST":true,"STOPRST":true},"write_protected":false,"wrpr":"0xffffffff"}}
