{"contract":"4","ok":true,"cmd":"target.option.get","result":{"data0":"0xff","data1":"0xff","db_family":"CH32M030","family":"unknown(0x8e)","raw":"a55ad728ff00ff00ff00ff00ff00ff00","rdpr":"0xa5","read_protected":false,"user":"0xd7","user_bits":{"OV_CFG":true,"RST_MODE":false,"RST_PIN_SEL":false,"STANDYRST":true,"STOPRST":true},"write_protected":false,"wrpr":"0xffffffff"}}
